no,display,list_no,category,name,address,lat,lng,phone1,phone2,memo1,memo2,area,hours,closing,diaper,URL
,,,飲食店,萬正食堂,輪島市新橋通り8-2-32,37.39427,136.898342,0768-22-0433,,お子様のメニューなど、相談ができます。広めの個室があるので小さい子がいても安心して入れるお店。電話で確認してみてください。,駐車場、個室、お座敷、テーブル席、カウンター席,,11:30~14:00(Lo13:30),17:00~20:00(Lo19:30),木,無,
,,,飲食店,やぶ新橋,輪島市河井町24-17,37.3934427,136.9010537,Tel0768-22-0006,Fax0768-22-9416,お子様メニューあり。お蕎麦やうどん、丼物など、子連れに嬉しいメニューが豊富です。,駐車場、エレベーター、個室、お座敷、テーブル席,,11:00~21:00（Lo20:30）観光センターで不定休日の確認ができます。,火,無,http://yabu-shinbashi.jp/
,,,飲食店,babybread(ベイビーブレッド),輪島市河井町2-241-5,37.39369276,136.9018154,0768-23-1811,,無添加のパン屋さん。卵、乳製品を使わないパンもあります。イートイン可。,トイレ、カウンター席,,08:00~19:00,日、月,無,https://www.facebook.com/babybread-1416724425243530/?fref=ts
,,,飲食店,カフェ一互一笑(いちごいちえ),輪島市宅田町25-4-10,37.38478118,136.8987884,0768-22-4141,,ランチ700円～ととてもリーズナブル.健常者と障碍者が協力して運営されていて、テーブルや器など、いたるところに輪島塗が使われている暖か味のあるお店.,駐車場、テーブル席(畳敷き),,10:30~15:30（Lo15:00）,日、月,無,
,,,飲食店,喫茶　翁(おきな),輪島市河井町17-2-16,37.3901627,136.9069367,0768-22-0300,,子供に人気のメニューが沢山.ベビーカーで入っても快く迎えてくれます.,駐車場、テーブル席、カウンター席,,06:00~19:00(Lo18:30),第１、３(日)午後,無,https://www.facebook.com/喫茶-翁-227274180700941/timeline
,,,飲食店,310(さと),輪島市河井町20部1番地60,37.3882046,136.9080506,0768-23-4435,,売り切れ次第終了してしまう人気のパン屋さん.イートイン可,駐車場、トイレ、お座敷,,07:40~18:00,日,無,https://www.facebook.com/310ぱん-114560498877230/?fref=ts
,,,飲食店,手打ちうどん　まる陣,輪島市マリンタウン4-2,37.395582,136.909178,0768-23-4451,,季節限定の能登の食材を使ったメニューもあります。,駐車場、トイレ、お座敷、テーブル,,11:00~14:30,17:30~20:00(Lo19:30),毎週水曜、第四火曜,無,https://www.facebook.com/手打ちうどん-まる陣-564673240344260/timeline
,,,飲食店,めん処　あさひ支店,輪島市河井町4-54,37.395043,136.905067,0768-22-0774,,,駐車場、トイレ、お座敷、テーブル,,11:00~19:00,3日、13日、23日、他１日不定,無,
