no,when,eventtitle,openTime,closeTime,where,place,whom,what,who,phone,email,contact,fee,url,tag1,uid,timestamp,soucefile,totaluser
,2018/01/09,輪島市乳幼児健康相談,10:00:00,11:00:00,輪島市もんぜん児童館,,乳幼児,身体測定＆保健師・栄養士がお子さんの成長や健康についての相談をお伺いします,輪島市健康推進課,0768-23-1136,,,0,,,evt58ef8902801,2017/04/15 14:50:31,takese_evt_0406.csv,reisiu
192,2018/01/16,ママのホッとティータイム,10:00:00,11:30:00,穴水町児童館,,乳幼児,子育てママが抱える様々な思いを自由に話し、仲間の話に耳を傾けホッと一息するママのための場所です。【定員６名】【託児要事前予約】,穴水町,0768-52-3220,,穴水町児童館,0,,,evt58f023b4837,2017/04/15 14:50:31,anamizuh28_evt.csv,reisiu
,2018/01/17,輪島市乳幼児健康相談,10:00:00,11:30:00,null,,乳幼児,身体測定＆保健師・栄養士がお子さんの成長や健康についての相談をお伺いします,輪島市健康推進課,0768-23-1136,,,0,,,evt58ef88ac777,2017/04/15 14:50:31,takese_evt_0406.csv,reisiu
,2018/01/19,輪島市乳幼児健康相談,10:00:00,11:00:00,町野めばえ子育て支援室,,乳幼児,身体測定＆保健師・栄養士がお子さんの成長や健康についての相談をお伺いします,輪島市健康推進課,0768-23-1136,,,0,,,evt58ef8954789,2017/04/15 14:50:31,takese_evt_0406.csv,reisiu
,2018/01/26,輪島市おやこ子育て広場・のびのび広場,10:00:00,11:30:00,null,,4～6か月児,離乳食の調理実習＆発達や生活リズムなどのお話,輪島市健康推進課,0768-23-1136,,,0,,,evt58ef8981441,2017/04/15 14:50:31,takese_evt_0406.csv,reisiu
